{"base":{"git_commit":"0123456789abcdef0123456789abcdef01234567"},"candidate_id":"ee47d3d59df2d689a263edf248abe6177ddb01300617f011cc276cb11a92ccec","constraints":{"forbid_binary":true,"max_files_changed":1,"max_lines_changed":2,"max_patch_bytes":10000},"determinism":{"generator_id":"test-generator-v1","seed":1},"eval_plan_id":"eval_plan_default_v1","format":"repo_patch_candidate_v1","patch":{"byte_length":131,"format":"unified_diff_v1","sha256":"34911e24713815922690a412a850ac9de37fbe80a64fdbdd60a25137abdfad91"},"rationale":"Minimal test vector patch.","schema_version":"1","target_repo_id":"agi-system","touched_paths":["README.md"]}